{
  "schemaVersion": 1,
  "id": "organization",
  "locators": {
    "pageTitle": { "css": ".govorg .gs-page-header__title", "description": "Page header title (h1) of an Organization screen" },
    "pageSubtitle": { "css": ".govorg .gs-page-header__subtitle", "description": "Page header subtitle" },
    "headerBadge": { "css": ".govorg .gs-page-header__meta .gs-badge", "description": "Office status badge in the page header" },
    "headerBadgeExpected": { "css": ".govorg .gs-page-header__meta .gs-badge[data-status=\"${observed.office.badgeStatus}\"]", "description": "Header status badge carrying the office's persisted status" },
    "addOffice": { "css": ".govorg .gs-page-header__actions a[href$=\"/gov-store/admin/organization/create\"]", "description": "Registry: Add office button" },

    "secNavCurrent": { "css": ".govorg .govorg-secnav a[aria-current=\"page\"]", "description": "Organization section nav: current section" },
    "secNavNational": { "css": ".govorg .govorg-secnav a[href*=\"/jurisdictions\"], .govorg .govorg-secnav a[href$=\"/directory\"]", "description": "Section nav links to national sections (super users only)" },

    "tabs": { "css": ".govorg .gs-status-tabs .gs-tabs__link", "description": "Registry status tabs" },
    "tabCurrent": { "css": ".govorg .gs-status-tabs .gs-tabs__link[aria-current=\"page\"]", "description": "Registry: current status tab" },
    "tabAllCount": { "css": ".govorg .gs-status-tabs .gs-tabs__item:first-child .gs-tabs__count", "description": "Registry tab count: All" },
    "tabActionCount": { "css": ".govorg .gs-status-tabs a[href*=\"status=action\"] .gs-tabs__count", "description": "Registry tab count: Needs your action" },
    "tabSetupCount": { "css": ".govorg .gs-status-tabs a[href*=\"status=setup\"] .gs-tabs__count", "description": "Registry tab count: Setting up" },
    "tabLiveCount": { "css": ".govorg .gs-status-tabs a[href*=\"status=live\"] .gs-tabs__count", "description": "Registry tab count: Live" },
    "tabPausedCount": { "css": ".govorg .gs-status-tabs a[href*=\"status=paused\"] .gs-tabs__count", "description": "Registry tab count: Paused" },
    "tabNoneCount": { "css": ".govorg .gs-status-tabs a[href*=\"status=none\"] .gs-tabs__count", "description": "Registry tab count: Not onboarded" },
    "tabLive": { "css": ".govorg .gs-status-tabs a[href*=\"status=live\"]", "description": "Registry tab: Live" },
    "tabLiveCurrent": { "css": ".govorg .gs-status-tabs a[href*=\"status=live\"][aria-current=\"page\"]", "description": "Registry tab Live marked current" },
    "attentionBanner": { "css": ".govorg .gs-alert:has(a[href*=\"status=action\"])", "description": "Registry banner: N offices are waiting on you" },

    "search": { "css": ".govorg form[role=\"search\"] #search", "description": "Registry search field (instant filter)" },
    "searchActive": { "css": ".govorg form[role=\"search\"] #search[value=\"${observed.registry.sampleOfficeName}\"]", "description": "Registry search field after the filtered page loaded" },
    "showing": { "css": ".govorg p.govorg-small[aria-live=\"polite\"]", "description": "Registry: Showing x–y of N offices" },
    "rows": { "css": ".govorg table tbody tr[data-govorg-href]", "description": "Registry rows (whole-row links)" },
    "rowsNotLive": { "css": ".govorg table tbody tr[data-govorg-href] .gs-badge:not([data-status=\"office_operational\"])", "description": "Registry rows whose badge is not Live" },
    "sampleRow": { "css": ".govorg table tbody tr[data-govorg-href]:has(a.govorg-office:text-is(\"${observed.registry.sampleOfficeName}\"))", "description": "Registry row of the selected office" },
    "sampleRowLink": { "css": ".govorg table tbody tr[data-govorg-href] a.govorg-office:text-is(\"${observed.registry.sampleOfficeName}\")", "description": "Office name link in the selected row" },
    "sampleRowNext": { "css": ".govorg table tbody tr[data-govorg-href]:has(a.govorg-office:text-is(\"${observed.registry.sampleOfficeName}\")) .govorg-next", "description": "Next step text of the selected row" },
    "sampleRowBadge": { "css": ".govorg table tbody tr[data-govorg-href]:has(a.govorg-office:text-is(\"${observed.registry.sampleOfficeName}\")) .gs-badge[data-status=\"${observed.office.badgeStatus}\"]", "description": "Status badge of the selected row with the persisted status" },
    "sampleRowHref": { "css": ".govorg table tbody tr[data-govorg-href$=\"/gov-store/admin/organization/${observed.registry.sampleOfficeId}/hub\"]", "description": "Selected row links to that office's hub" },

    "readiness": { "css": ".govorg .gs-readiness", "description": "Readiness checklist card" },
    "readinessTitle": { "css": ".govorg .gs-readiness__title", "description": "Readiness headline" },
    "readinessCount": { "css": ".govorg .gs-readiness__count", "description": "Readiness: N of 4 done" },
    "readinessItems": { "css": ".govorg .gs-readiness__item", "description": "Readiness rows" },
    "readinessDone": { "css": ".govorg .gs-readiness__item--done", "description": "Readiness rows that are done" },
    "readinessActions": { "css": ".govorg .gs-readiness__item a.gs-btn", "description": "Fix-it buttons on open readiness rows" },

    "hubToc": { "css": ".govorg nav.govorg-toc a", "description": "Office hub section links" },
    "rolesBox": { "css": "#govorg-roles", "description": "People and roles section" },
    "adminPicker": { "css": "#govorg-roles select#office_admin_id", "description": "Office administrator picker (hub only)" },
    "adminSlotPerson": { "css": "#govorg-roles .gs-role:has(#office_admin_id) .gs-role__person-name", "description": "Hub: person holding the office administrator slot (the slot with the picker)" },
    "myAdminSlotPerson": { "css": "#govorg-roles .gs-role:not(form[action$=\"/gov-store/office/save\"] .gs-role) .gs-role__person-name", "description": "My office: person holding the read-only office administrator slot" },
    "roleSlotsNeeded": { "css": "#govorg-roles .gs-role--required", "description": "Required role slots still empty" },
    "approverPicker": { "css": "#govorg-roles select#primary_approver_id", "description": "Approver picker" },
    "staffRows": { "css": "#govorg-staff table tbody tr", "description": "Staff table rows" },
    "details": { "css": "#govorg-details", "description": "Office details section" },
    "technicalDetails": { "css": "#govorg-location details .govorg-mono", "description": "Area code / location id, behind Technical details" },
    "timelineItems": { "css": "#govorg-activity .gs-timeline__item", "description": "Activity entries" },

    "settings": { "css": "#govorg-settings", "description": "Settings section" },
    "pauseButton": { "css": "#govorg-settings button[data-target=\"#govorg-dialog-suspend\"]", "description": "Settings: Pause…" },
    "moveButton": { "css": "#govorg-settings button[data-target=\"#govorg-dialog-relocate\"]", "description": "Settings: Move…" },
    "closeDisabled": { "css": "#govorg-close button[disabled][aria-describedby=\"govorg-close-why\"]", "description": "Settings: Close… disabled with its reason" },
    "closeWhy": { "css": "#govorg-close-why", "description": "Why Close is unavailable" },
    "pauseDialog": { "css": "#govorg-dialog-suspend", "description": "Pause dialog" },
    "pauseDialogEffects": { "css": "#govorg-dialog-suspend .govorg-effects li", "description": "Pause dialog: what stops / continues / locks" },
    "pauseReason": { "css": "#lifecycle-reason-suspend", "description": "Pause dialog: reason" },
    "pauseAck": { "css": "#lifecycle-ack-suspend", "description": "Pause dialog: I understand checkbox" },
    "pauseCancel": { "css": "#govorg-dialog-suspend .modal-footer button[data-dismiss=\"modal\"]", "description": "Pause dialog: Cancel" },
    "pauseExpectedStatus": { "css": "#govorg-dialog-suspend input[name=\"expected_status\"][value=\"${observed.office.status}\"]", "description": "Pause form carries the concurrency guard for the persisted status" },

    "findInput": { "css": "#govorg-step-find #find", "description": "Add office step 1: office name search" },
    "findSubmit": { "css": "#govorg-step-find button[type=\"submit\"]", "description": "Add office step 1: Search" },
    "findNone": { "css": "#govorg-step-find p[aria-live=\"polite\"]", "description": "Add office step 1: result line" },
    "officeName": { "css": "form #name", "description": "Add office: Office name" },
    "officeTypeDefault": { "css": "input[name=\"office_type\"][value=\"default\"]", "description": "Add office: office type choice (default)" },
    "createSubmit": { "css": "#govorg-step-create button[type=\"submit\"]", "description": "Add office: Create office" },
    "errorSummary": { "css": ".govorg form .gs-alert--danger", "description": "Error summary at the top of the form" },
    "errorSummaryArea": { "css": ".govorg form .gs-alert--danger a[href=\"#geo_area_id\"]", "description": "Error summary entry linking to the area field" },
    "errorSummaryName": { "css": ".govorg form .gs-alert--danger a[href=\"#name\"]", "description": "Error summary entry linking to the name field" },
    "areaFieldError": { "css": "#geo_area_id-error", "description": "Message under the area field" },

    "adminsTabs": { "css": ".govorg .gs-status-tabs .gs-tabs__link", "description": "Administrators tabs" },
    "adminsIctCount": { "css": ".govorg .gs-status-tabs a[href$=\"/jurisdictions\"] .gs-tabs__count", "description": "Administrators tab count: Area ICT officers" },
    "adminsMinistryCount": { "css": ".govorg .gs-status-tabs a[href$=\"/company-admins\"] .gs-tabs__count", "description": "Administrators tab count: Ministry administrators" },
    "adminsIctCurrent": { "css": ".govorg .gs-status-tabs a[href$=\"/jurisdictions\"][aria-current=\"page\"]", "description": "Area ICT officers tab marked current" },